Product Title,Original Title,Shopify Price,Source Price,Profit Margin %,Product URL,Seller Name,Seller Rating,Image Count,Final Score,SKU
Magnetic Original Phone Case for Iphone 14 Pro Max,Original Silicone Phone Case With MagSafe For iPhone 14 Pro Max 14 Pro 14 Plus,$17.57,$12.55,40.0%,https://www.ebay.com/itm/286453125268,,N/A,10,211,EBAY_90ABC41E
Shockproof Waterproof Phone Case for Galaxy S21,"Waterproof Shockproof Phone Case For Samsung Galaxy S21,S21+ Plus, S21 Ultra 5G",$26.59,$18.99,40.0%,https://www.ebay.com/itm/255052193355,,N/A,10,205,EBAY_3991B4FF
Leather Phone Case for Iphone 16,Personalised Leather Phone Case for iPhone 16 16e 15 14 13 12 Pro Max Initials,$15.32,$10.94,40.0%,https://www.ebay.com/itm/267388387040,,N/A,10,203,EBAY_D1366EFD
Fast Protective Case for Samsung,SAMSUNG OEM FAST RAPID CHARGER EARPHONES & PROTECTIVE CASE EARBUDS BUNDLE 3 IN 1,$15.81,$11.29,40.0%,https://www.ebay.com/itm/133372585612,,N/A,10,193,EBAY_CF81A31D
Case for Samsung Galaxy,Charging Case w/ USB Cable for Samsung Galaxy Buds 3 Pro R630 Earbuds Charger 5V,$27.12,$19.37,40.0%,https://www.ebay.com/itm/335924511907,,N/A,10,185,EBAY_F5E0DD2E
